{
  "$schema": "https://json-schema.org/draft/2020-12/schema",
  "$id": "https://github.com/alexplvl100/StrongContextConvolution/core/schemas/chunk.schema.json",
  "title": "SCC chunk",
  "description": "Сжатый ядром SCC фрагмент контекста. Чанк неизменяем после записи (инвариант 4 METHODOLOGY_MEMORY.md): новое сжатие создаёт chunk_{n+1}, а не перезаписывает предыдущие. Поле level различает, где чанк находится СЕЙЧАС: medium — в стаке, который ещё помещается в харнесс; long — вынесен в архив и доступен только через Архивариуса.",
  "type": "object",
  "additionalProperties": false,
  "required": [
    "n",
    "source_range",
    "tokens_before",
    "tokens_after",
    "created_at",
    "content",
    "cas_refs",
    "level"
  ],
  "properties": {
    "n": {
      "type": "integer",
      "minimum": 1,
      "description": "Порядковый номер чанка. Нумерация сквозная внутри диалога: chunk_1, chunk_2, ... Номер НЕ переиспользуется даже после выноса в архив."
    },
    "parent_chunk": {
      "type": [
        "integer",
        "null"
      ],
      "minimum": 1,
      "description": "Номер предыдущего чанка в цепочке либо null для первого. Поле описывает порядок появления, а не порядок чтения: источник правды о порядке — chain.json (инвариант 6)."
    },
    "source_range": {
      "type": "object",
      "additionalProperties": false,
      "required": [
        "start",
        "end"
      ],
      "description": "Границы исходного контекста, который заменил этот чанк. start/end — номерные метки событий (E<N>), а не байтовые смещения: ядро работает с событиями, а не с текстом.",
      "properties": {
        "start": {
          "type": [
            "integer",
            "string"
          ],
          "description": "Начало диапазона включительно."
        },
        "end": {
          "type": [
            "integer",
            "string"
          ],
          "description": "Конец диапазона включительно."
        }
      }
    },
    "tokens_before": {
      "type": "integer",
      "minimum": 0,
      "description": "Токенов во входном диапазоне до сжатия. Источник — измерение, а не оценка: см. METHODOLOGY_MEMORY.md о способе подсчёта."
    },
    "tokens_after": {
      "type": "integer",
      "minimum": 0,
      "description": "Токенов в чанке после сжатия (с учётом замен CAS, если они применены)."
    },
    "created_at": {
      "type": "string",
      "format": "date-time",
      "description": "Момент создания чанка, ISO 8601."
    },
    "content": {
      "type": "string",
      "description": "Сжатое описание событий с постфиксом-маркером сжатия у каждого события. Маркер в текущей реализации — (_SSC_); см. RESEARCH/R-SCC-01 о его происхождении."
    },
    "level": {
      "type": "string",
      "enum": [
        "medium",
        "long"
      ],
      "description": "Текущий уровень памяти. short здесь НЕ допускается: короткая память — это несжатый контекст в харнессе, у неё нет чанка (METHODOLOGY_MEMORY.md)."
    },
    "cas_refs": {
      "type": "array",
      "items": {
        "type": "string",
        "pattern": "^[0-9a-f]{8}$"
      },
      "description": "Хеши точных данных, заменённых в content ссылками вида LB?{хеш}?. Пустой массив, если замен не было. Оригиналы лежат в runtime/dialogs/<dialog_id>/cas.db (CAS — content-addressed store)."
    }
  }
}
